{
  "authorization_status": "approved",
  "blockers": [],
  "completed_wave_ids": [
    "checks"
  ],
  "dispatch_id": "native-dispatch-runner-success-canary",
  "eligible_action_ids": [
    "spawn-0002"
  ],
  "run_id": "native-dispatch-runner-success-20260722",
  "schema_version": "arcanum.native-dispatch-runner.state.v0.1",
  "selected_wave_id": "dependent",
  "state": "gate_pass",
  "validation_status": "pass"
}
