{
  "authorization_status": "approved",
  "blockers": [],
  "completed_wave_ids": [],
  "dispatch_id": "dispatch-pre-execution-owner-prerequisite-fast-path-v1",
  "eligible_action_ids": [
    "spawn-0001"
  ],
  "run_id": "pep-whole-pack-20260804-retry-001",
  "schema_version": "arcanum.native-dispatch-runner.state.v0.1",
  "selected_wave_id": "pep-serial-frontier",
  "state": "wave_ready",
  "validation_status": "pass"
}
