{
  "authorization_status": "approved",
  "blockers": [
    "action 'spawn-0002': non-pass status 'block'",
    "action 'spawn-0002': non-pass validation 'block'",
    "action 'spawn-0002': receipt declares blockers"
  ],
  "completed_wave_ids": [],
  "dispatch_id": "fixture-native-dispatch-two-wave",
  "eligible_action_ids": [],
  "run_id": "run-fixture-001",
  "schema_version": "arcanum.native-dispatch-runner.state.v0.1",
  "selected_wave_id": "checks",
  "state": "gate_block",
  "validation_status": "pass"
}
