{
  "authorization_status": "approved",
  "blockers": [],
  "completed_wave_ids": ["checks"],
  "dispatch_id": "fixture-native-dispatch-two-wave",
  "eligible_action_ids": ["spawn-0004"],
  "run_id": "run-fixture-001",
  "schema_version": "arcanum.native-dispatch-runner.state.v0.1",
  "selected_wave_id": "artifact",
  "state": "gate_pass",
  "validation_status": "pass"
}
